{
  "pack_id": "ftc",
  "pack_version": "0.1.0",
  "framework": "ftc",
  "description": "FTC Endorsement Guides and advertising rules covering endorsements, claims, disclosures, and consumer protection",
  "rule_ids": [
    "FTC-255-0-scope",
    "FTC-255-1-honest",
    "FTC-255-1-substantiation",
    "FTC-255-1-current",
    "FTC-255-2-typical",
    "FTC-255-2-disclosure",
    "FTC-255-3-expert",
    "FTC-255-4-org",
    "FTC-255-5-connection",
    "FTC-255-5-clear",
    "FTC-255-5-social",
    "FTC-truth-advertising",
    "FTC-hidden-fees",
    "FTC-bait-switch",
    "FTC-255-0-purpose",
    "FTC-255-1-misleading",
    "FTC-255-1-typical",
    "FTC-255-2-consumer",
    "FTC-255-2-actor",
    "FTC-255-3-expert-qualified",
    "FTC-255-3-expert-evaluation",
    "FTC-255-5-material-connection",
    "FTC-255-5-employee",
    "FTC-255-5-free-product",
    "FTC-255-5-affiliate",
    "FTC-255-5-disclosure-clear",
    "FTC-255-6-liability",
    "FTC-255-6-monitoring",
    "FTC-260-1-purpose",
    "FTC-260-3-general",
    "FTC-260-3-qualification",
    "FTC-260-4-general-benefit",
    "FTC-260-5-carbon",
    "FTC-260-6-seals",
    "FTC-260-7-compostable",
    "FTC-260-8-degradable",
    "FTC-260-9-free-of",
    "FTC-260-10-nontoxic",
    "FTC-260-12-recyclable",
    "FTC-260-13-recycled",
    "FTC-260-15-renewable",
    "FTC-260-16-materials",
    "FTC-251-1-free-genuine",
    "FTC-251-1-conditions",
    "FTC-251-1-regular-price",
    "FTC-251-1-shipping",
    "FTC-251-1-continuous",
    "FTC-238-1-bait",
    "FTC-238-2-switch",
    "FTC-238-3-adequate-supply",
    "FTC-238-4-refusal",
    "FTC-233-1-former-price",
    "FTC-233-2-retail-value",
    "FTC-233-3-list-price",
    "FTC-233-4-bargain",
    "FTC-REVIEW-FAKE",
    "FTC-REVIEW-INCENTIVE",
    "FTC-REVIEW-EMPLOYEE",
    "FTC-REVIEW-SUPPRESS",
    "FTC-REVIEW-MANIPULATE",
    "FTC-REVIEW-PLATFORM",
    "FTC-CLAIM-WEIGHT",
    "FTC-CLAIM-HEALTH",
    "FTC-CLAIM-CLINICAL",
    "FTC-CLAIM-DOCTOR",
    "FTC-CLAIM-PERCENT",
    "FTC-CLAIM-GUARANTEE",
    "FTC-CLAIM-BEST",
    "FTC-CLAIM-SCIENTIFIC",
    "FTC-SCARCITY-STOCK",
    "FTC-SCARCITY-TIMER",
    "FTC-SCARCITY-SALE",
    "FTC-SCARCITY-DEMAND",
    "FTC-SCARCITY-EXCLUSIVE",
    "FTC-FREE-CONDITION",
    "FTC-FREE-TRIAL",
    "FTC-NEGATIVE-OPTION",
    "FTC-CANCEL-HARD",
    "FTC-RECURRING-HIDE",
    "FTC-USA-UNQUALIFIED",
    "FTC-USA-ASSEMBLED",
    "FTC-USA-ORIGIN",
    "FTC-DARK-CANCEL",
    "FTC-DARK-CONFIRM",
    "FTC-DARK-PRESELECT",
    "FTC-DARK-HIDDEN",
    "FTC-DARK-MISDIRECT",
    "FTC-NATIVE-EDITORIAL",
    "FTC-NATIVE-DISCLOSURE",
    "FTC-GREEN-ECO",
    "FTC-GREEN-RECYCLE",
    "FTC-GREEN-DEGRADE",
    "FTC-GREEN-CARBON",
    "FTC-GREEN-NATURAL",
    "FTC-GREEN-SUSTAIN"
  ]
}
